{
	"$schema": "http://json-schema.org/draft-07/schema",
	"$id": "release-it.json",
	"title": "JSON schema for release-it configuration",
	"type": "object",
	"additionalProperties": false,
	"properties": {
		"$schema": {
			"type": "string",
			"description": "The JSON schema version used to validate this configuration file"
		},
		"extends": {
			"type": "string",
			"description": "URL that specifies a configuration to extend"
		},
		"hooks": {
			"type": "object",
			"additionalProperties": true,
			"patternProperties": {
				"^(before|after):((version|git|npm|github|gitlab):)?(init|bump|release)$": {
					"if": {
						"type": "array"
					},
					"then": {
						"type": "array",
						"items": {
							"type": "string"
						}
					},
					"else": {
						"type": "string"
					}
				}
			}
		},
		"plugins": {
			"type": "object",
			"additionalProperties": true
		},
		"git": {
			"$comment": "Boolean or git config object",
			"if": {
				"type": "object"
			},
			"then": {
				"$ref": "https://unpkg.com/release-it@21.1.0/schema/git.json"
			},
			"else": {
				"type": "boolean",
				"default": false
			}
		},
		"npm": {
			"$comment": "Boolean or npm config object",
			"if": {
				"type": "object"
			},
			"then": {
				"$ref": "https://unpkg.com/release-it@21.1.0/schema/npm.json"
			},
			"else": {
				"type": "boolean",
				"default": false
			}
		},
		"github": {
			"$comment": "Boolean or github config object",
			"if": {
				"type": "object"
			},
			"then": {
				"$ref": "https://unpkg.com/release-it@21.1.0/schema/github.json"
			},
			"else": {
				"type": "boolean",
				"default": false
			}
		},
		"absences": {
			"title": "Packages sanctioned for absence. The key is the path to the package, the value is the reason for its absence",
			"type": "object",
			"additionalProperties": true,
			"patternProperties": {
				"^.*$": {
					"type": "string",
					"title": "Path to package",
					"description": "Reason for the package's absence"
				}
			}
		},
		"quiet": {
			"type": "boolean",
			"default": false,
			"description": "Suppress preview output (changelog, changeset, release notes) during the release flow. Does not affect the --changelog mode."
		}
	}
}
