{
	"$schema": "./config/release.schema.json",
	"plugins": {
		"@release-it-plugins/workspaces": {
			"workspaces": [
				"packages/activity-lexicon",
				"packages/address-id",
				"packages/ancestrie",
				"packages/evidence",
				"packages/annotations",
				"packages/api",
				"packages/api-kit",
				"packages/ban",
				"packages/bdc",
				"packages/cartographer",
				"packages/coastal",
				"packages/codex",
				"packages/core",
				"packages/corpus",
				"packages/dossier",
				"packages/fastify",
				"packages/filer",
				"packages/flood",
				"packages/geographic-model",
				"packages/kind-classifier",
				"packages/libpostal",
				"packages/locale-hint",
				"packages/mailwoman",
				"packages/map-tui",
				"packages/match",
				"packages/mcp",
				"packages/neural",
				"packages/neural-weights-de-de",
				"packages/neural-weights-en-au",
				"packages/neural-weights-en-gb",
				"packages/neural-weights-en-in",
				"packages/neural-weights-cjk",
				"packages/neural-weights-en-nz",
				"packages/neural-weights-en-us",
				"packages/neural-weights-es-es",
				"packages/neural-weights-fr-fr",
				"packages/neural-weights-it-it",
				"packages/neural-weights-ja-jp",
				"packages/neural-weights-zh-cn",
				"packages/nominatim",
				"packages/normalize",
				"packages/nuts-lookup",
				"packages/osm",
				"packages/photon",
				"packages/phrase-grouper",
				"packages/poi-taxonomy",
				"packages/query-shape",
				"packages/react",
				"packages/record",
				"packages/registry",
				"packages/resolver",
				"packages/resolver-wof-sqlite",
				"packages/resolver-wof-wasm",
				"packages/sentencepiece-wasm",
				"packages/soil",
				"packages/spatial",
				"packages/sqlite",
				"packages/tiger",
				"packages/timezone-lookup",
				"packages/un-locode-lookup",
				"packages/variant-aliases",
				"packages/zoning"
			],
			"publish": true,
			"publishCommand": "yarn mwops release publish-workspace --allow-unplanned",
			"skipChecks": true
		}
	},
	"npm": false,
	"git": {
		"commitMessage": "release: v${version}",
		"tagName": "v${version}",
		"tagAnnotation": "Release v${version}",
		"requireCleanWorkingDir": true,
		"requireBranch": "main"
	},
	"github": {
		"release": true,
		"releaseName": "v${version}",
		"releaseNotes": "git log --pretty=format:'* %s (%h)' ${latestTag}...HEAD --no-merges"
	},
	"hooks": {
		"before:init": [
			"echo 'Pre-flight: compile + copy-weights (tests skipped \u2014 PR CI already validated)'",
			"yarn compile",
			"yarn mwops release copy-weights"
		],
		"after:bump": "yarn oxfmt package.json '**/package.json'",
		"after:release": "echo 'Released v${version}'"
	},
	"absences": {
		"packages/browser": "private browser automation for acquisition and agent tools — never publishes",
		"docs": "private Docusaurus site — never publishes",
		"packages/tile-worker": "private demo-map tile worker — never publishes",
		"packages/license-worker": "private license worker — Cloudflare infrastructure, never publishes",
		"packages/earth": "private Earth map app — Cloudflare infrastructure, never publishes",
		"packages/planetary": "private Moon and Mars map app — Cloudflare infrastructure, never publishes",
		"packages/astrogeology": "private planetary data pipeline — no published consumer yet",
		"packages/geocode-oracle": "private verification oracle — never a runtime dependency, never publishes",
		"packages/ofcom": "private Ofcom Connected Nations reader — no published consumer yet",
		"packages/bduk": "private reader for Building Digital UK's UPRN-level release — no published consumer yet",
		"packages/route-scenarios": "private shared-route cost and cash-flow scenario calculator — no published consumer yet",
		"packages/opportunity-map": "private data model of the building and shared-route opportunity map — no published consumer yet",
		"packages/opportunity-app": "private opportunity map application — undeployed, never publishes",
		"packages/neural-weights-base-latn": "parked shared base for #1177 — publish wiring deliberately not landed"
	}
}
